Series Number,Filename,Name,Description,Gender,UUID,hashed_key386,Anansi,Anansi,Anansi is a trickster god of stories of the Ghana people.,Male,784f0f6b-4273-4a31-88d7-2455b96c9011,eb6d6f33543b512e35ad926bed8da0143c77df13fb94cc3b9ed78757509864cd
387,Nyame,Nyame,Nyame is the omnipotent god of the Ghana region.,Male,f3af0bbd-0724-4696-89ff-ed67f63e6b4f,b1d6d1e7f0b10da81a079fedc0850025da106ffc171fa6c78bd0fe23d0ba900c
388,Obatala,Obatala,Obatala is the lord of all gods in the Yoruba land.,Male,c447c120-830e-4543-9cb3-5917ba36bce8,4dfb778706998b7fd2e629dd19c8397fa0f0bba00635490b367d3059f8c9bff5
389,Erinle,Erinle,"Erinle is a powerful hunter of the Yoruba land.,",Male,dacbbb38-087d-4248-8085-13b619da0ef9,814ad72af80301e45ef4d6c41db2c827de8e1656426ca7cd00bd3eb109d9a094
390,Ogun,Ogun,Ogun is the Yoruba God of iron and metal work.,Male,94c607b3-791e-40df-bd93-50926f094143,50f8c6f151a85d69b3aa939ed51165bf2c789066e4f08e2a74b3b4027505e4b2
391,Abosom,Abosom,Abosom is the goddess of wisdom and knowledge of the Ghana people.,Female,b3427836-627b-41e4-a2d0-c29473448343,2752cfb370accddfd8deb5d5f04323bf6c71739fd1552a57cb8a08a3f4609c63
392,Oya,Oya,Oya is the goddess of violent storms and winds of the Yoruba people.,Female,22aaebe4-4659-44de-ab3d-c4dae11fe9f5,069e403431b3b44e596ed8524a292de40a77dada312fec2b0395a61420afb54d
393,Agbala,Agbala,Agbala is the stylish goddess of the future for the Igbo region.,Female,ca720bf9-5e47-4421-b38f-bc62162ae99e,47e9bcca0034e31702ff24ac4fa62f7c5171818291f7e613252809b69e247d10
394,Njoku-ji,Njoku-ji,Njoku-ji is the goddess of new yam of the Igbo people.,Female,3b795bad-91b4-4d0e-8ed8-bccbb226fc55,61a16eee87cb727fe05162d1be5578106906d4f3d6c1c2c54b3f5103ad6fd1fc
395,Akonadi,Akonadi,Akonadi is the goddess of justice and prophesies of the Ghana people.,Female,2aebd094-3be5-4773-a7a0-361f6332a7d4,cc7428933c8923654ea9fe5c807205f969479cc3d0e5331e811307dbb906b222
396,Onyame,Onyame,Onyame is the goddess of the moon of the ghana region,Female,fb148f97-d309-45a4-b902-4e066ca13f96,8aa1f8e110861ce63c24dd70c8ca43b8a6b38e31fcb097971bed045591cae506
397,Ibeji,Ibeji,Ibeji is the goddess of balance and twin of the Yoruba people.,Female,7b210c03-5446-462d-980e-c73dbbc1e386,fa1dd440ad79f45f01d4ec3a5346d01c29a10e8b2a9822a164090e055288fdeb
398,Asase-ya,Asase-ya,Asase-ya is the goddess of fertility and love of the Ghanaian people,Female,80b51092-3fbc-4d0c-8518-fc461ccb6c80,581defe806558f2b55f9337444e371273ced3a2fcf9dd1fea8e8572206bacce9
399,Yemoja,Yemoja,Yemoja is the stylish yoruba goddess of the rivers.,Female,1693b44d-96cf-4c2d-89be-9f4219c28447,45f343b0bdf98a4ead38fb994af1783e9088d4aafff5599d07413f294b1f3671
400,Yemaya,Yemaya,Yemaya is the Ghana goddess of rivers and waters.,Female,9609d0f4-d9d3-4cff-aa06-a9c459fefa39,35e9a79a137749327d585505a280d88878b96d6239b388fc387f9db6b724665f
,,,,,,a88e54c2b7b8f29cb3a537147039a81ecf4149931f44bf6b33857e1bca86a89e
TEAM BOOT,,,,,,355a99c7af86004a2f09eda3038898a2b1b3f82b827d3b8797c42cd84c84ac81
401,smirky-becky,smirky-becky,Becky ends every statement she makes with a smirk.,female,87bcc41f-eb3e-4ba2-9645-223c949a9b50,3162665b60d7e88da96f6332a8bbca5842b631541d53ea321c502bd2d723f4a8
402,ankara-scarlett,ankara-scarlett,Scarlett is a tailor at yaba market and she loves what she does.,female,66d0149f-5f2a-4ded-8e6b-9bd7d7631c39,5a7734b3984fa58f36913a5f52379ee3140d92186e69442864e141affe3a00a6
403,sea-rastafaria,sea-rastafaria,Ronke is the ghetto goddess that nobody wants to mess with. Stay clear!,female,d1556c97-9075-49fc-8bde-1826bfc2dbe1,ec319cc33b6806fab9273a0ea54736423124592b30d5ea541a7522914363456b
404,pretty-betty,pretty-betty,Betty is always proud of her beauty.,female,6a4f5b7c-914d-42c5-8e5f-d1c34ca48886,b280d73c5626c4eec647c712d04347454a80cbaa64be3ca52d514c36553c24c8
405,lola-medusa,lola-medusa,Lola knows how to seduce every guys she is into.,female,32ec57f7-8272-4671-ad2d-db3dff99fe9f,4339dea8fb26138e3d55256b6aa2d5e29db2edc4ac3a0345cd1d85afc902553c
406,bukola-nosend,bukola-nosend,Bukola is friends with many but always get moody.,female,59d19b13-09e2-412e-a669-df020e03ae10,e0ad9fb363a5d14bd418427cae865f95fcf75b74c359b1bb8e67ab5e8fdc45df
407,burna-morgan,burna-morgan,Morgan paints the town red with her red hair.,female,d08af477-de20-4780-8449-46b87840b9fa,289991e4d37b39a7201f721e45656e1f537810c81e2a3cffb7a23a8b4686beed
408,afro-star,afro-star,Bimbo is an afro star with great affluence.,female,40743b16-ae12-4b4a-989c-e5fbf1e2e0ca,e0f160e0335adcd80958cc74da8c07faa0a454a9904a12938ae9be6d709cb2d7
409,fiesty-sandra,fiesty-sandra,"Sandra is a social animal, correct owambe ambassador.",female,d875aa6c-3e4a-4450-b09c-e9f1cdcc3947,f8a9b1c7c023d9f836494c0ebaf5696d34d1228412c4129bca2be0c918ec7496
410,sister-nkechi-sabi,sister-nkechi-sabi,"Nkechi is the true definition of amebo, always in peoples business.",female,a728a380-1d33-4080-841d-80b041474d8f,a0c9cbe0b118b6131bca8e13c0d9b88a216231c6b4907e055cda24b1497dcb41
411,unfriendly-gina,unfriendly-gina,"Gina is an angry one, she has no friends but she has a lot of money.",female,dd30a327-8a74-40a5-8207-19a790508ccc,59f2b07ac519c200288b384d224c1f0702570c70bb996979ee6523e0d06a00cb
412,dada-ganster,dada-ganster,"Dada respects no one, always finds pleasure terrorising others.",female,e1a43f65-aad2-4385-ac5e-bc159c6e0f2a,1dd6f61239c48f9f3b1c90ce20997ba20a26aadba0cae6a5ec23bec38d1f0fbd
413,idoncare-linda,idoncare-linda,"Linda is a beautiful but very annoying girl, she turns every thing to a fight.",female,ed04b47c-ae98-4db2-b71b-04d7bb976d45,26d50a03dff026ab389eeb026f2fc46c336ec55d2e350fc29e27e7c5bf489fbe
414,doubting-vivian,doubting-vivian,"Vivian just like the thomas in the bible, she doubts all.",female,a0282797-44ef-4bfb-a701-e4ed5e727d63,dca9432471cd4eacecab4786a39216a477b1bcfebd781f1edd51a716c7a81c79
415,simbi-side-eyed,simbi-side-eyed,Simbi is reserved but doesn't allow anyone intimidate her.,female,1f99104c-e98b-4c9a-9891-00a481e86008,1abcca5f1e5abc4021a96c4cd840fd9b6d6d01f26dc1ffa820d2b33c0409c5ce
416,bambi-tekno,bambi-tekno,Bambi is the dancer of the team.,female,95ff5e2c-1ff2-4d58-890b-de0f39f9d8ce,4e22cad3c079b46ebf9fc4aa1023f73584d57dfdb57784f070dd30b29a97c98a
417,saka-portable,saka-portable,Saka is forever convinced that his toothless smile is the icing on his cake.,male,bd98f74f-e42e-494e-8298-3183555ca666,caf912dc38e06c8b8d9fa6f27877feb1135b7f4a450b62789f4ee7ec0154e3ce
418,king-of-boys,king-of-boys,Busayo finds her way in ruling the boys and that's why she's king of boys.,female,a650e79c-f964-4eb1-aa89-f9c1dbdede76,1eb8893db5060db5735bf905057f3830667e64dd41ffa64ef9d8a7e8fca5563a
419,funky-alte-pop,funky-alte-pop,"Funke is always the life of every party, strong gen z advocate.",female,b6753a8b-6127-4e97-812b-99e465791ba3,aba921d9bfedb9b7d03ccb5d284cc74a1f6357fc8aad31b1ee981fc29591ae8a
420,madame-ngozi,madame-ngozi,Ngozi make heads turn with her bright colours.,female,7ecdbb1d-9a89-4136-b240-499051836979,c1a50cd0eba27cb85cd139041da603dc894725a4c928396ac429677c03fab17f
